{
  "transferEventId": "aaaaaaaa-aaaa-4aaa-8aaa-aaaaaaaaaaaa",
  "transferSessionId": "66666666-6666-4666-8666-666666666666",
  "commandId": "11111111-1111-4111-8111-111111111114",
  "roomId": "22222222-2222-4222-8222-222222222222",
  "deviceId": "33333333-3333-4333-8333-333333333333",
  "schemaVersion": 1,
  "occurredAt": "2026-07-11T09:03:05Z",
  "status": "completed",
  "relativePath": "documents/report.pdf",
  "bytesUploaded": 524288,
  "totalBytes": 524288,
  "chunkSizeBytes": 1048576,
  "sha256": "aaaaaaaaaaaaaaaaaaaaaaaaaaaaaaaaaaaaaaaaaaaaaaaaaaaaaaaaaaaaaaaa",
  "sourceModifiedUnixMs": 1783760400000
}
